,idx,title,ingredients,directions,#actions
4792,4792,Mexican Casserole,"[""1 can whole kernel corn, drained"", ""1 can Spanish rice, drained"", ""1 can Ranch Style beans (black label), drained"", ""1 lb. hamburger meat, browned, seasoned and drained"", ""1 medium onion, chopped fine and cooked with hamburger meat"", ""1 medium block Longhorn style cheese, shredded"", ""salt and pepper"", ""garlic salt"", ""Worcestershire sauce""]","[""Cook spices, onion and hamburger meat together until well browned; drain and add corn, Spanish rice and beans."", ""Mix well and place in casserole dish with cover."", ""Heat in a 350\u00b0 oven just until cheese is"", ""melted thoroughly."", ""Stir melted cheese into mixture well, then add remaining shredded cheese on top, covering fully."", ""Heat again until mixture has cheese melted thoroughly on top."", ""Serve with Mexican-style corn chips."", ""This can be frozen for future meals.""]",4
4793,4793,Hungarian Goulash,"[""1 to 2 lb. stew meat"", ""1 onion, chopped"", ""salt"", ""pepper"", ""paprika"", ""1 to 2 Tbsp. flour"", ""water"", ""1 Tbsp. oil""]","[""Heat oil in large pan."", ""Add beef cubes, brown them on all sides, stirring every couple of minutes."", ""Add 1 onion, chopped. Continue browning meat-onion mixture for a minute or so."", ""Sprinkle flour on mix, stirring constantly, adding water slowly to prevent clumping of flour."", ""Season with salt, pepper and paprika."", ""Sauce should be spicy."", ""Simmer slowly for 1 hour stirring occasionally. Serve over cooked noodles or rice with a salad."", ""(To ensure tender meat, cover pot during simmering.)""]",4
4794,4794,Giant Chocolate Chippers,"[""1 c. sugar"", ""1 c. firmly packed brown sugar"", ""1 c. margarine or butter, softened"", ""1 c. oil"", ""1 egg"", ""2 tsp. vanilla"", ""3 1/2 c. all-purpose or unbleached flour"", ""1 tsp. baking soda"", ""1 tsp. cream of tartar"", ""1 tsp. salt"", ""1 c. quick cooking rolled oats"", ""1 c. coconut"", ""1 c. crisp rice cereal"", ""12 oz. pkg. (2 c.) chocolate chips""]","[""Heat oven to 350\u00b0."", ""Line cookie sheets with foil."", ""In large bowl, beat sugar, brown sugar and margarine until light and fluffy. Add oil, egg and vanilla."", ""Beat well."", ""Lightly spoon flour into measuring cup."", ""Level off and add flour, baking soda, cream of tartar and salt."", ""Stir in oats, coconut, cereal and chocolate chips."", ""Press scant cup of dough into a 6-inch circle on foil-lined cookie sheet."", ""Repeat with remaining dough, placing cookies at least 2 1/2 inches apart."", ""Bake at 350\u00b0 for 18 to 22 minutes, or until light and golden brown."", ""Cool completely on cookie sheets to prevent breaking."", ""Makes 8 large cookies, 32 servings.""]",4
4819,4819,Jack'S Good Tastin' Pinto Beans And Ground Meat,"[""2 c. pinto beans, picked, washed and soaked overnight"", ""1 can stewed tomatoes"", ""1/2 c. chopped onions"", ""1/2 c. chopped bell peppers"", ""1/2 c. chopped celery"", ""1 clove chopped garlic (optional)"", ""8 c. water"", ""salt and pepper to taste"", ""1/2 c. flour"", ""salt pork (as desired)"", ""1 lb. ground meat""]","[""Drain water from beans that soaked overnight."", ""In a large saucepan, combine water, salt pork, salt and pepper."", ""Bring to a boil."", ""Add beans, tomatoes, onions, bell peppers, garlic and celery."", ""Cook on medium heat, adding water as needed, until beans are tender or until placing a cooked bean in a spoon and checking tenderness by smashing in the spoon."", ""Beans are done when they smash with little pressure."", ""Measure a cup of the liquid from the pot. Add flour to the liquid and mix well."", ""Return this mixture to the pot and cook an additional 10 to 20 minutes."", ""This method will bring all the flavors together."", ""If desired, brown ground meat in skillet and add to beans."", ""Wow How Good.""]",4
4854,4854,Best Ever Cucumber Sweet Pickles,"[""fresh cucumbers (firm and a good size for pickle)""]","[""Slice, strip, chunk, halve or crinkle cut; whichever you want. Pack quart jars fairly tight."", ""To each jar, add 1 teaspoon salt and 1 teaspoon alum."", ""Fill jar with cider vinegar to cover."", ""Apply tops."", ""No need to sterilize."", ""Just be new and clean."", ""That's the easy part!"", ""Now, put away for 5 to 6 months, even a year."", ""The curing process doesn't take that long actually."", ""They are ready when rusty green."", ""To make off:"", ""Turn jars upside down in sink (top removed) to drain."", ""Drain 5 to 6 hours or longer."", ""Invert jars; fill with sugar (right out of the bag) as much as jar will hold. Apply tops and shake, shake, shake until sugar dissolves."", ""You will need to do this approximately 3 times until enough syrup to completely cover cucumbers."", ""When this is accomplished, add per quart, 1 teaspoon celery seed and 1 teaspoon whole allspice."", ""Apply tops and shake, shake."", ""That's it."", ""Let sit a few days."", ""Simply delicious.""]",4
4873,4873,Aunt Ethel'S Old Fashioned Chicken And Dumplings,"[""2 to 3 lb. chicken, cut up"", ""1 onion, chopped"", ""1/2 c. celery, chopped"", ""salt and pepper to taste"", ""2 c. plain flour"", ""2 large eggs"", ""1/3 c. oil"", ""ice water (about 1 c.)""]","[""Stir flour, eggs and oil together."", ""Then add a little ice water at a time, until mixture forms a ball."", ""Sprinkle ball with flour for easy handling and divide into 3 balls."", ""Roll each ball out on well-floured board, real thin."", ""Cut into 2-inch squares and drop in simmering broth where chicken was cooked."", ""Should have at least 2 quarts of broth."", ""Repeat with each ball, rolling thin, cutting into squares and dropping in broth."", ""Stir well and simmer about 10 minutes."", ""Add cut-up chicken."", ""If broth seems too thin, thicken with a little flour dissolved in water.""]",4
4893,4893,60 Minute Southern Rolls,"[""3 1/2 c. flour"", ""1 Tbsp. sugar"", ""1 tsp. salt"", ""1/2 tsp. baking soda"", ""1 pkg. yeast"", ""1 c. buttermilk"", ""1/4 c. water"", ""2 Tbsp. margarine"", ""additional flour for dusting""]","[""Set aside 1 cup flour."", ""In bowl mix remaining flour, sugar, salt, soda and yeast."", ""Heat buttermilk, water and margarine to 125\u00b0 to 130\u00b0."", ""Stir into dry ingredient mixture."", ""Mix in enough reserved flour to make soft dough."", ""Knead 3 minutes."", ""Press evenly in greased 9 x 9 x 2-inch pan."", ""Dust top with flour."", ""With sharp knife, score dough into 16 rolls; cover."", ""Let rise 20 minutes, then bake 20 to 25 minutes in a 350\u00b0 oven."", ""Remove from oven and break into rolls."", ""Serve warm.""]",4
4915,4915,Peanut Butter Cookies,"[""1/3 c. flour"", ""1/4 tsp. baking soda"", ""1/4 tsp. baking powder"", ""1/4 c. low-fat margarine"", ""4 Tbsp. peanut butter"", ""2 tsp. granulated sugar substitute"", ""2 tsp. brown sugar substitute"", ""1 egg, beaten""]","[""Sift dry ingredients together."", ""Cream margarine and peanut butter; beat until light and fluffy."", ""Add sugar substitutes and egg and beat well."", ""Add dry ingredients and mix into creamed mixture and mix well."", ""Drop by teaspoons onto lightly greased cookie sheet, flatten with tines of fork dipped in flour."", ""Bake in preheated oven at 375\u00b0 for 8 to 10 minutes."", ""Yield: 20 cookies. Carbohydrate 2.7 g, protein 1.3 g, fat 3.0 g, calories 41."", ""One cookie = 1/4 bread exchange, 1/2 fat lean meat exchange.""]",4
4962,4962,Baklava (Greek Pastry),"[""2 large pkg. filo dough"", ""3 c. sugar"", ""5 Tbsp. cinnamon"", ""1 Tbsp. cloves"", ""2 sticks butter"", ""1/4 c. lemon juice"", ""3 c. finely chopped pecans"", ""1 c. honey"", ""1/2 c. water""]","[""In saucepan, melt butter; set aside."", ""In bowl, mix sugar, cinnamon, cloves and pecans; set aside."", ""In large 13 x 9-inch pan, layer filo (3 or 4 sheets) and brush with butter."", ""Sprinkle with pecan mixture."", ""Layer more filo brushed with butter, pecan mixture, etc., ending with filo."", ""Cut into 4-inch square and cut 4-inch squares into 2-inch triangles."", ""Bake at 375\u00b0 until golden brown."", ""Cool.""]",4
5014,5014,"""Delightfully Quick Stir-Fry""","[""1 (14 oz.) can Contadina pasta ready"", ""1 (8 oz.) lobster or crab Louis Kemp Delights"", ""1 1/2 c. cooked rice"", ""other vegetables of your choice (optional)""]","[""Heat a little olive oil in your wok or pan."", ""Put the lobster Delights in the hot oil and cook until they are hot (about 2 to 3 minutes)."", ""Add the pasta ready and stir until the sauce is hot. Spoon over cooked rice (or pasta)."", ""If you wish to include other vegetables, cook them 5 to 7 minutes in the oil, then add the Lobster Delights.""]",4
5092,5092,Chinese Barbecued Pork,"[""1 lb. pork"", ""6 Tbsp. soy sauce"", ""1 green onion, chopped"", ""4 slices ginger"", ""2 Tbsp. wine"", ""1 garlic clove, cracked"", ""1 tsp. sugar"", ""1 Tbsp. honey"", ""1 Tbsp. oil""]","[""Cut pork into long strips about 2 inches wide and 2 inches thick."", ""Soak the first six ingredients for half a day or overnight."", ""Rub the meat (at room temperature) with garlic, sugar and honey."", ""Heat oven at 400\u00b0."", ""Roast the pork for 35 minutes, turning strips over once during roasting process."", ""Remove pork from oven and slice.""]",4
5099,5099,Steak In Beer Sauce,"[""1 1/2 lb. beef round steak (1-inch thick)"", ""2 Tbsp. cornstarch"", ""2 tsp. salt"", ""1/4 tsp. each: pepper and garlic"", ""2 Tbsp. oil"", ""1 large onion, sliced"", ""1 (12 oz.) beer"", ""1/4 tsp. hot pepper sauce"", ""1 Tbsp. brown sugar"", ""4 large carrots, sliced diagonally 1-inch thick""]","[""Pound steak."", ""Cut in thin slices."", ""Blend cornstarch and spices. Coat the meat slices and brown well in hot oil."", ""Add onion and cook 3 minutes."", ""Stir in the beer, pepper sauce and sugar. Bring to boil and simmer on low heat, covered 15 minutes."", ""Add carrots and simmer until meat and carrots are tender."", ""Serve over cooked rice.""]",4
5139,5139,Jelly Roll(Kaaretorttu)  ,"[""3 eggs"", ""1/2 c. sugar"", ""3/4 c. sifted white flour"", ""1/2 tsp. baking powder"", ""dash of salt"", ""1 tsp. vanilla"", ""1 c. fruit or berry jam"", ""1 c. cream, whipped or may use Cool Whip"", ""confectioners sugar""]","[""Beat eggs until light; add sugar and beat until thick."", ""Add the vanilla."", ""Sift flour with baking powder and salt and fold carefully into the egg mixture until well combined."", ""Line a jelly roll pan with waxed paper."", ""Butter it very well and sprinkle it generously with granulated sugar."", ""Spread the batter evenly in the pan and bake in a moderate 350\u00b0 oven for 20 minutes or until the cake is just set."", ""Turn out onto a clean tea towel that has been well dusted with confectioners sugar and roll up while still hot. Cool slightly, then unroll and remove from the towel."", ""When it has cooled, spread the inside of the roll with the jam and whipped cream."", ""Reroll."", ""May use fresh strawberries and Cool Whip inside, but make sure jelly roll is cool.""]",4
5147,5147,Grape Juice,"[""5 lb. grapes"", ""sugar"", ""2 c. water""]","[""Stem and wash grapes."", ""To each 5 pounds grapes, add 2 cups water."", ""Cover and let come slowly to a boil; simmer until well cooked."", ""Remove from heat and place in cloth sack to drain.""]",4
5165,5165,Venison Stew,"[""2 Tbsp. oil"", ""3 large onions, coarsely chopped"", ""1 Tbsp. Worcestershire sauce"", ""1 tsp. oregano"", ""1 tsp. pepper"", ""7 potatoes, peeled and quartered"", ""1 lb. carrots, cut into 1-inch pieces"", ""bottled browning sauce (optional)"", ""1 lb. venison stew meat"", ""2 garlic cloves, crushed"", ""1 bay leaf"", ""1 Tbsp. salt"", ""3 c. water"", ""1/4 c. flour"", ""1/4 c. cold water""]","[""Heat oil in a Dutch oven."", ""Brown meat."", ""Add onions, garlic, Worcestershire sauce, bay leaf, oregano, salt and pepper."", ""Simmer, covered, 1 1/2 to 2 hours or until meat is tender."", ""Add potatoes and carrots."", ""Continue to cook until vegetables are tender, about 30 to 45 minutes."", ""Mix flour and water."", ""Stir into stew."", ""Cook and stir until thickened and bubbly."", ""Add browning sauce, if desired. Remove bay leaf."", ""Makes 8 to 10 servings.""]",4
5179,5179,Best-Ever Banana Bread,"[""1 3/4 c. flour"", ""2 1/4 tsp. baking powder"", ""1/4 tsp. salt"", ""1/3 c. butter or margarine, softened"", ""2/3 c. sugar"", ""1 1/2 tsp. pumpkin pie spice"", ""2 eggs"", ""1 tsp. vanilla"", ""1 c. mashed bananas""]","[""Preheat oven to 350\u00b0."", ""Mix flour, baking powder and salt; set aside."", ""In a medium bowl, cream the butter, sugar and pumpkin pie spice until fluffy."", ""Beat in eggs one at a time; add vanilla."", ""Add 1/3 of the flour mixture alternately with 1/3 cup of bananas; beat until smooth."", ""Repeat with remaining flour and bananas."", ""Pour into greased 9 x 5-inch loaf pan."", ""Bake about 55 minutes or until cake tester inserted into center comes out clean."", ""Makes one loaf.""]",4
5182,5182,"Chicken, Artichoke And Spinach Casserole","[""1 can artichokes"", ""1 pkg. frozen chopped spinach"", ""3 chicken breast halves"", ""1 can cream of chicken soup"", ""1/2 c. Hellmann's mayonnaise"", ""1 Tbsp. lemon juice"", ""1 tsp. curry"", ""3/4 c. sharp cheese, grated"", ""1/2 c. bread crumbs (Progresso seasoned)"", ""2 Tbsp. butter""]","[""Cook chicken breasts in seasoned water (celery, salt and pepper)."", ""Remove from bone and skin."", ""Pull from bone."", ""In buttered casserole (11 x 7 x 2-inch), layer artichokes, spinach (which has been thawed, drained and squeezed) and chicken pieces evenly distributed in bite size pieces."", ""Combine soup, lemon juice and curry powder and spread on top."", ""Sprinkle cheese over and top with bread crumbs."", ""Dot with butter."", ""Bake at 350\u00b0 for 20 to 25 minutes until bubbles and heats thoroughly. Serve with rice cooked with consomme or bouillon, fruit or tossed salad."", ""Serves 6.""]",4
5192,5192,Fruit-Glazed Easter Ham,"[""5 to 7 lb. smoked ham"", ""1 (8 oz.) can crushed pineapple, drained"", ""1/3 c. orange marmalade"", ""2 Tbsp. lemon juice"", ""1/4 tsp. ground cinnamon"", ""dash of allspice"", ""1/3 c. flaked coconut""]","[""Place ham, fat side up, on rack in open roasting pan."", ""Insert meat thermometer so bulb is centered in thickest part."", ""Be careful bulb does not rest in fat or on bone."", ""Do not add water."", ""Do not cover."", ""Roast at 325\u00b0 until meat thermometer registers 130\u00b0 to 140\u00b0 for \""fully cooked\"" half ham (18 to 24 minutes per pound) or 160\u00b0 for a \""cook before eating\"" half ham (22 to 25 minutes per pound).""]",4
5213,5213,Clarabell Hartman'S Banana Refrigerator Dessert,"[""1 tsp. vanilla"", ""16 large marshmallows or 1 1/2 c. miniature"", ""1/2 c. milk"", ""20 half graham crackers"", ""1 stick melted butter"", ""3 bananas, sliced"", ""1/2 pt. whipping cream, whipped""]","[""Melt marshmallows in milk in saucepan over medium heat."", ""Cool, then add vanilla."", ""Next crush graham crackers and add melted butter."", ""Mix well."", ""Pat half of mixture into a square pan."", ""Put a layer of sliced bananas on top of crumbs."", ""Add whipped cream to marshmallow mixture."", ""Put a layer of this mixture over bananas, then a second layer of bananas and a second layer of cream mixture. Sprinkle remaining crumbs on top."", ""Chill several hours or overnight.""]",4
5311,5311,Microwave Chocolate Pie,"[""1/2 c. sugar"", ""1/4 tsp. salt"", ""3 Tbsp. cornstarch"", ""6 Tbsp. dry milk"", ""1 Tbsp. cocoa"", ""1 Tbsp. oleo"", ""2 1/2 c. water"", ""1 tsp. vanilla""]","[""In bowl safe for microwave, mix all dry ingredients, then add 1/2 cup water."", ""Beat well, then add the other 2 cups water."", ""Beat again."", ""Microwave on High for 2 minutes."", ""Beat again."", ""It takes about 8 minutes."", ""Beat after every 2 minutes."", ""Be sure to stir it good off the bottom."", ""Beat in oleo and vanilla."", ""Pour into 9-inch baked pie shell.""]",4
5325,5325,Clam Fritters,"[""25 medium clams, shucked, drained and chopped fine"", ""2 medium onions, chopped finely"", ""1 egg, lightly beaten"", ""2 c. pancake flour"", ""1/4 tsp. seasoning salt"", ""1/4 tsp. pepper"", ""vegetable oil""]","[""Combine pancake mix, salt and pepper; set aside."", ""In another bowl beat egg and add onions."", ""Mix well."", ""Stir mixture into dry ingredients."", ""Add clams."", ""Stir until smooth."", ""Drop clam mixture into large cast-iron skillet with hot oil. Fry until golden brown.""]",4
5412,5412,Chicken Casserole,"[""1 whole chicken or 3 whole chicken breasts"", ""1 pkg. herb stuffing mix"", ""1 stick butter or margarine"", ""1 can cream of mushroom soup"", ""1 can cream of chicken soup"", ""1 can cream of celery soup"", ""1 can chicken broth or 1 1/2 c. broth from cooked chicken""]","[""Cook chicken without adding salt. Debone it and cut into small pieces."", ""Melt butter and add to stuffing mix, mixing well."", ""Spread half the mixture in bottom of a 9 x 13-inch pan or dish. Combine soups and chicken broth. Spread half the soup mixture over the stuffing."", ""Spread chicken over soups."", ""Layer rest of soups over this and top with rest of stuffing mix. Bake at 300\u00b0 about 30 minutes until mixture is hot through and brown."", ""Yields 12 servings.""]",4
5454,5454,Touchdown Chocolate Bars,"[""1 3/4 c. unsifted flour"", ""1 c. sugar"", ""1/4 c. cocoa"", ""1/2 c. cold margarine or butter"", ""1 egg, beaten"", ""1 (14 oz.) can Eagle Brand sweetened condensed milk"", ""2 c. (12 oz. pkg.) semi-sweet chocolate chips"", ""1 c. chopped nuts""]","[""Preheat oven to 350\u00b0."", ""Combine flour, sugar and cocoa; cut in margarine until crumbly."", ""Add eggs; mix well."", ""Reserve 1 1/2 cups crumb mixture."", ""Press remainder evenly on bottom of greased 13 x 9-inch baking pan."", ""Bake 10 minutes."", ""In a saucepan, combine Eagle Brand and 1 cup chocolate chips."", ""Over low heat, cook and stir until chips melt and mixture is smooth."", ""Spread evenly over prepared crust."", ""Add nuts and remaining 1 cup chocolate chips to reserved crumb mixture; sprinkle evenly over top."", ""Bake 25 to 30 minutes or until center is set."", ""Cool."", ""Cut into bars."", ""Store covered at room temperature.""]",4
5461,5461,Homemade Ice Cream(Very Smooth)  ,"[""2 cans Eagle Brand milk"", ""1 can condensed milk"", ""1 pt. whipping cream"", ""7 egg yolks"", ""7 egg whites"", ""1 pt. half and half"", ""2 tsp. vanilla or to taste"", ""2 c. fruit (optional)""]","[""In blender, mix Eagle Brand milk, condensed milk, whipping cream, half and half and egg yolks until smooth."", ""Beat egg whites until stiff."", ""Fold egg whites with blender mixture."", ""Add fruit, slowly blending in."", ""Pour in ice cream mixer and process according to directions."", ""If mixture does not come to fill line in mixer, add half and half to fill line.""]",4
5546,5546,Turtle Sundae Delight,"[""1 c. butter, melted"", ""1/2 c. brown sugar"", ""2 c. flour"", ""1/2 c. rolled oats"", ""1 c. pecans, chopped"", ""1 jar butterscotch topping"", ""1/2 gal. vanilla ice cream, softened"", ""1 jar chocolate topping""]","[""In mixing bowl, combine melted butter and brown sugar."", ""Add flour, rolled oats and pecans."", ""Mix until crumbly."", ""Pat on ungreased cookie sheet."", ""Bake at 375\u00b0 for 15 minutes."", ""Remove from oven and break up mixture."", ""Place half of crumbled mixture on bottom of 9 x 13-inch pan."", ""Drizzle jar of butterscotch sauce over the crumbs."", ""Spread ice cream on top."", ""Drizzle chocolate sauce over all."", ""Top with remaining crumb mixture."", ""Freeze overnight."", ""Cut into squares.""]",4
5556,5556,Chicken With Zucchini,"[""4 chicken cutlets (1 lb.)"", ""1/2 tsp. salt, divided"", ""1/8 tsp. pepper"", ""2 medium zucchini (1/2 lb.), cut into thin strips"", ""1 large clove garlic, minced"", ""2 Tbsp. thinly sliced fresh basil leaves"", ""basil sprigs (for garnish)"", ""2 Tbsp. olive oil, divided""]","[""Sprinkle both sides of chicken with 1/4 teaspoon salt and pepper."", ""In a large, nonstick pan, heat 1 tablespoon olive oil over medium-high heat."", ""Cook 2 chicken cutlets 5 to 7 minutes or until cooked through, turning once."", ""Remove chicken to a large serving platter."", ""Keep warm."", ""Repeat with the rest of chicken.""]",4
5564,5564,Paella,"[""1 lb. chicken, cut in small pieces"", ""1 lb. rabbit, cut in small pieces"", ""1/2 lb. pork, chopped, boned and cut in small pieces"", ""1 lb. mussels"", ""1 lb. shrimp, leave in shell"", ""1 clove garlic"", ""1 lb. clams"", ""3 tomatoes, peeled and chopped"", ""1 small onion, chopped"", ""1 Tbsp. parsley"", ""1/2 lb. scallops"", ""1 can peas or frozen"", ""pinch of saffron or 2 tsp. turmeric"", ""olive oil for frying"", ""1 chopped green pepper""]","[""In a paella pan or large skillet, fry chicken and rabbit. Remove."", ""In same pan, cook pork."", ""Remove."", ""In pan, saute onion, green pepper and garlic."", ""Add to the vegetables and chopped tomatoes."", ""Add parsley."", ""Re-add poultry and pork."", ""Mix well."", ""Add all seafood that has been washed."", ""Fill pan with water and bring to a boil."", ""Add 2 cups rice and saffron/turmeric and bring to second boil."", ""Add peas."", ""Simmer for 20 minutes or until rice is cooked."", ""Garnish with red peppers, sliced lemons or sliced oranges.""]",4
5603,5603,Eggplant Parmesan,"[""2 medium eggplants"", ""3/4 c. milk"", ""2 c. bread crumbs"", ""1 tsp. basil"", ""1/2 tsp. oregano"", ""1/2 tsp. thyme"", ""1 large jar tomato sauce (or homemade)"", ""1 lb. Mozzarella cheese, grated"", ""1/2 c. Parmesan cheese""]","[""Preheat oven to 375\u00b0."", ""Lightly oil a baking tray and a 9 x 13-inch pan."", ""Peel and cut eggplants into slices."", ""Combine bread crumbs and herbs."", ""Place milk in a shallow dish."", ""Dip eggplant in milk and then crumb mixture."", ""Put slices in pan and tray; bake for about 20 to 30 minutes."", ""Remove eggplant from pan and pour some tomato sauce on the bottom."", ""Layer pan with eggplant, sauce and Mozzarella cheese."", ""Repeat layers until you run out of food or room."", ""Sprinkle the top with Parmesan cheese."", ""Bake, uncovered, at 375\u00b0 for about 40 to 50 minutes."", ""Cool before serving.""]",4
5621,5621,Brunch Pie,"[""1 2/3 c. cheese cracker crumbs (40 crackers)"", ""1/4 c. soft butter"", ""1/2 lb. ham, cut in strips"", ""1/2 lb. turkey, cut in strips"", ""1 can (10 oz.) cream of chicken soup"", ""1/4 c. milk"", ""1/2 c. grated Cheddar cheese"", ""3 eggs, beaten"", ""2 tsp. prepared mustard"", ""1 tsp. Worcestershire sauce""]","[""Blend together the cracker crumbs and butter."", ""Press into a 9-inch pie plate using 8-inch pie plate."", ""Layer meat in shell except 10 to 12 strips."", ""Combine milk, soup and cheese; heat until cheese melts."", ""Add beaten eggs, mustard and Worcestershire sauce. Pour over meat."", ""Top with reserved meat strips."", ""Bake at 300\u00b0 for 45 minutes.""]",4
5683,5683,Chicken On A Stick(Serving Size:  4)  ,"[""4 boneless chicken breasts"", ""1/2 lb. sliced lengthwise bacon"", ""1/2 c. wine (red or white)"", ""1/4 c. soy sauce"", ""1/4 c. Worcestershire sauce"", ""seasonings (mixed)""]","[""Slice boneless chicken breasts in 1/2-inch strips."", ""Take the wooden sticks and weave alternating chicken and bacon strips until each stick is full."", ""Mix wine, soy and Worcestershire and place in a container large enough for the filled sticks to lay flat. Season with your favorite mixed seasonings."", ""If necessary to pile chicken sticks on top of each other, make sure you turn the filled sticks into the marinade so they all get at least 1/2 hour of marination."", ""Cook over low to medium heated grill or oven at 350\u00b0 for 1/2 to 3/4 hour."", ""Dip or baste chicken with marinade frequently to prevent drying of meat."", ""Do not overcook!""]",4
5722,5722,Pasta And Escarole,"[""4 cloves garlic, chopped"", ""2 Tbsp. olive oil"", ""1 (8 oz.) tomato sauce"", ""1 (8 oz.) can water (use juice from cooked escarole"", ""1 1/2 lb. escarole, washed, drained and cut into bite size pieces"", ""1 lb. can cannellini beans""]","[""Saute garlic in oil, add tomato sauce and water, and any salt, if desired."", ""Bring mixture to a boil, lower heat and add escarole, a little at a time."", ""Cook until tender, 30 minutes, stirring occasionally."", ""Add water if needed."", ""Five minutes before you are ready to serve, add the can of beans (rinse beans) and heat through."", ""Serve with spaghetti and grated cheese."", ""Makes 4 to 6 servings.""]",4
5771,5771,Cheese Mushroom Frittata,"[""1 c. cream of mushroom soup"", ""1/2 c. Mozzarella cheese, shredded"", ""1/8 tsp. pepper"", ""1 c. mushrooms, sliced"", ""1 medium onion"", ""tomato wedges"", ""6 eggs, slightly beaten"", ""1/4 tsp. dried basil leaves"", ""2 Tbsp. margarine or butter"", ""fresh parsley, chopped"", ""fresh basil leaves""]","[""In medium bowl with wire whisk, beat soup until smooth. Gradually blend in eggs, 1 cup of cheese, basil and pepper."", ""In 10-inch oven-safe omelet pan or skillet over medium heat in hot margarine, cook mushrooms and onion until mushrooms are tender and liquid is evaporated, stirring occasionally."", ""Pour mixture into skillet."", ""Reduce heat to low."", ""Cook 6 minutes or until edges are set 1-inch from edge."", ""Do not stir."", ""Remove from heat and serve. For garnish, use tomato wedges, chopped fresh parsley or fresh basil leaves.""]",4
