,idx,title,ingredients,directions,#actions
1704347,1704347,New Zealand Almond and Fig Bread,"[""3/4 cup/ about 4 ounces/ 117 grams bread flour"", ""1/2 teaspoon/ 1.6 grams instant yeast"", ""3/4 teaspoon/ 3.1 grams sugar"", ""3/4 liquid cup/ 6.2 ounces/ 177 grams water, at room temperature (70F to 90F)"", ""3/4 cup/ 4 ounces/ 117 grams bread flour, plus 2 tablespoons/ 0.6 ounce/ 19 grams for kneading"", ""1/2 cup/ 2.5 ounces/ 72 grams whole wheat flour"", ""1/2 teaspoon/ 1.6 grams instant yeast"", ""2 teaspoons/ 9 grams oil"", ""1 1/4 teaspoons/ 0.25 ounce/ 8.3 grams salt"", ""1 cup/ 2.6 ounces/ 75 grams unblanched slivered (not sliced) or whole almonds, coarsely chopped"", ""1/2 cup/ 2.6 ounces/ 75 grams dried Mission figs, stems removed, cut into 1/4 -to 1/2 -inch pieces, plus 1 whole fig for decor"", ""1 cup/ 2.6 ounces/ 75 grams sliced almonds"", ""3 tablespoons/ 1.75 ounces/ 50 grams apricot jelly"", ""2 tablespoons/ 1 ounce/ 30 grams water"", ""La Cloche Bread Baker OR a half sheet pan, either one lined with a nonstick liner such as Silpain or parchment, or sprinkled with flour or cornmeal"", ""A baking stone OR baking sheet""]","[""Oven Temperature: 425F, then 375F (if using La Cloche, 450F, then 400F)"", ""Make the sponge."", ""In a mixer bowl or other large bowl, place the flour, yeast, sugar and water."", ""Whisk until very smooth, to incorporate air, about 2 minutes."", ""The sponge will be the consistency of a thick batter."", ""Scrape down the sides of the bowl Set it aside, covered with plastic wrap, while you make the flour mixture."", ""Combine the ingredients for the flour mixture and add to the sponge."", ""In a medium bowl, whisk together the bread flour (reserve 1/4 cup if mixing by hand), whole wheat flour, and yeast."", ""Sprinkle this on top of the sponge and cover it tightly with plastic wrap."", ""Allow it to ferment for 1 to 4 hours at room temperature."", ""(During this time the sponge will bubble through the flour mixture in places; this is fine.)"", ""Mix the dough."", ""Mixer Method:"", ""Add the oil and mix with the dough hook on low speed (#2 if using a KitchenAid) until the flour is moistened enough to form a rough dough."", ""Scrape down any bits of dough."", ""Cover the bowl with plastic wrap and allow the dough to rest for 20 minutes."", ""Sprinkle on the salt and knead the dough on medium speed (#4 KitchenAid) for 7 minutes."", ""It will be smooth and shiny and cling slightly to your fingers, If it is still very sticky, knead in a little flour."", ""If it is not at all sticky, spray it with a little water and knead it in."", ""(It will weigh about 17 ounces/ 490 grams.)"", ""Allow the dough to rest for 10 minutes."", ""Turn the dough out onto a lightly floured counter and roll it into a rectangle about 9 inches by 14 inches."", ""Sprinkle with the chopped almonds and cut-up figs."", ""Roll up the dough and knead it for a few minutes to incorporate the almonds and figs evenly."", ""Shape it into a ball."", ""Hand Method:"", ""Add the oil and salt and, with a wooden spoon or your hand, mix until the flour is moistened."", ""Knead the dough in the bowl until it comes together, then scrape it onto a lightly floured counter."", ""Knead the dough for 5 minutes, enough to develop the gluten structure a little, adding as little of the reserved 1/4 cup of flour as possible to keep it from sticking."", ""use a bench scraper to scrape the dough and gather it together as you knead it."", ""At this point, it will be very sticky."", ""Cover it with the inverted bowl and allow it to rest for 20 minutes."", ""(This resting time will make the dough less sticky and easier to work with.)"", ""Knead the dough for another 5 minutes or until it is very smooth and elastic."", ""It should still be moist enough to cling slightly to your fingers."", ""If it is very sticky, add some of the remaining reserved flour, or a little extra."", ""(The dough will weigh about 17 ounces/490 grams.)"", ""Allow the dough to rest for 10 minutes."", ""Roll the dough into a rectangle about 9 inches by 14 inches, and sprinkle with the almonds and cut-up figs."", ""Roll up the dough and knead it for a few minutes to incorporate the almonds and figs evenly."", ""Shape it into a ball."", ""Both Methods:"", ""Let the dough rise."", ""Set the dough in a 4-quart dough-rising container or bowl, lightly greased with cooking spray or oil."", ""Press down the dough and lightly spray or oil the top."", ""Cover the container with a lid or plastic wrap."", ""With a piece of tape, mark the side of the container at approximately where double the height of the dough would be."", ""Allow the dough to rise (ideally at 75F to 80F) until doubled, about 1 1/2 hours."", ""Using an oiled spatula or dough scraper, scrape the dough out into a floured counter, and press down on it gently to form a rectangle."", ""Fold the dough into a tight package or give it 2 business letter turns, and set it back in the container."", ""Oil the surface again, cover, and mark where double the height of the dough would now be."", ""It will fill the container fuller than before because it is puffier with air."", ""Allow the dough to rise until doubled, about 1 hour."", ""Shape the dough, encrust it with almonds, and let it rise."", ""Turn the dough out onto a lightly floured counter and press down on it gently to flatten it slightly."", ""Round the dough into a 4 1/2 -inch ball and lightly spray or brush the surface with water."", ""Scatter the almonds on a counter."", ""Roll the ball of dough in the almonds to cover it completely, pressing the nuts into the dough."", ""Firmly push the whole fig, pointed end down, into the center so that it is submerged as deeply as possible into the dough."", ""The loaf will measure 5 inches by 1 1/2 -inches high."", ""Place it on the baking sheet or the La Cloche base."", ""Cover it with a large container, or cover loosely with oiled plastic wrap."", ""Let the dough rise until doubled, about 1 hour to 1 hour and 15 minutes."", ""It will be about 5 1/2 inches by 3 inches high, and when it is pressed gently with a fingertip, the depression will very slowly fill in."", ""press any remaining almonds into the empty spaces created by the doughs expansion."", ""Preheat the oven."", ""Preheat the oven to 425F, or 450F if using La Cloche, 1 hour before baking."", ""Have an oven shelf at the lowest level and place an oven stone or baking sheet on before preheating."", ""If using La Cloche, preheat the dome along with the oven."", ""Bake the bread."", ""If using La Cloche, carefully place the hot dome onto the base and quickly but gently set it on the hot stone or hot baking sheet."", ""Bake for 10 minutes."", ""Lower the temperature to 400F and continue baking for 30 to 35 minutes or until the bread is golden brown and a skewer inserted in the middle comes out clean (an instant-read thermometer inserted into the center will read about 190F)."", ""Alternatively, quickly but gently set the baking sheet on the hot stone or hot baking sheet."", ""Bake for 5 minutes."", ""Lower the temperature to 375F and continue baking for 35 to 40 minutes or until the bread is golden brown and a skewer inserted into the middle comes out clean (an instant-read thermometer inserted into the center will read about 190F.)"", ""If the nuts begin to brown, tent the loaf loosely with aluminum foil."", ""Halfway through baking, turn the pan around for even baking."", ""Glaze the bread."", ""Meanwhile, in a small saucepan, mix the apricot jelly and water together."", ""Bring to a boil and simmer for 1 to 2 minutes, stirring constantly."", ""With a spoon, press the preserves through a strainer to make a smooth glaze."", ""When the bread is done, remove it from the oven and brush It with the hot apricot glaze."", ""Return it to the oven for 1 minute to set the glaze."", ""Cool the bread."", ""Remove the bread from the oven and transfer it to a wire rack to cool completely."", ""Ultimate Full Flavor Variation:"", ""For the best flavor development, in Step 2, allow the sponge to ferment for 1 hour at room temperature, then refrigerate it for 8 to 24 hours."", ""If using the hand mixing method, remove it from the refrigerator about 1 hour before mixing the dough.""]",39
1709602,1709602,San Francisco Sourdough,"[""2/3 cup (8 ounces) levain proof, recipe follows"", ""1 cup (8 fluid ounces) spring water"", ""1 1/2 cups (8 ounces) organic white flour with germ"", ""1 1/4 cups (6-ounces) 20 percent bran wheat flour"", ""Full batch chef, procedure and recipe follows"", ""The Chef"", ""Day 1"", ""3/4 cup plus 2 tablespoons (4 ounces) 20 percent bran wheat flour"", ""1/2 cup (4 fluid ounces) spring water""]","[""Combine the levain and water in a 2-quart clear plastic container with a lid."", ""Break up the levain well with a wooden spoon or squeeze through your fingers until it is broken up."", ""Stir until the levain is partly dissolved and the mixture is slightly frothy."", ""Add the flour and stir with a wooden spoon until very thick and sticky."", ""Scrape down the sides with a rubber spatula."", ""Cover with plastic wrap and put in a moderately warm (74 to 80 degree) place for 24 hours."", ""Final dough: 2 cups (16 fluid ounces) spring water 5 1/2 to 6 1/2 cups (27 to 32 ounces) organic white flour with germ 1 tablespoon (3/4 ounce) fine sea salt"", ""Combine the poolish and water in a 6-quart bowl."", ""Break up the poolish well with a wooden spoon and stir until the poolish becomes loose and the mixture slightly frothy."", ""Add 2 cups (10 ounces) of the flour and the salt; stir until well combined."", ""Add just enough of the remaining flour to make a thick mass that is difficult to stir."", ""Turn out onto a lightly floured surface and knead, adding remaining flour when needed, until dough is firm and smooth, 15 to 17 minutes total."", ""The dough is ready when a little dough pulled from the mass springs back quickly."", ""Shape the dough into a ball and let it rest on a lightly floured surface while you scrape, clean, and lightly oil the largest bowl."", ""Place the dough in the bowl and turn once to coat with oil."", ""Take the dough's temperature: the ideal is 78 degrees."", ""Cover with a clean damp towel or plastic wrap and put in a moderately warm (74 to 80 degree) draft-free place until doubled in volume."", ""Deflate the dough by pushing down in the center and pulling up the sides."", ""Cover with a clean damp towel or plastic wrap and put in a moderately warm (74 to 80 degree) draft-free place for 30 minutes."", ""Transfer the dough to a lightly floured board and knead briefly."", ""Shape into a tight ball."", ""Cover with a clean damp towel or plastic wrap, and put in a moderately warm (74 to 80 degree) draft-free place for 30 minutes."", ""Divide the dough into 2 equal portions."", ""Flatten each with the heel of your hand on a lightly floured board."", ""The dough may be very soft and loose at this point."", ""Shape into 12-inch-long torpedoes."", ""You may also choose to shape the dough into rounds."", ""Place the torpedoes, seam side up in a well-floured couche*."", ""Cover with a clean damp towel or plastic wrap."", ""Put in a moderately warm (74 to 80 degrees) draft-free place until increased in volume about 1 1/2 times, or until a slight indentation remains when the dough is pressed with a fingertip."", ""Place rounds on a cornmeal-dusted surface to rise."", ""Preheat the oven and baking stone to 450 degrees, 45 minutes to 1 hour before baking."", ""The oven rack must be in the center of the oven."", ""If it is in the lower 1/3 of the oven the bottom of the breads may burn, and if it is in the upper 1/3, the top crusts may burn."", ""Gently roll one loaf from the couche onto a lightly floured peel so that it sits seam side down."", ""Using a very sharp, serrated knife or a single-edged razor blade, score the loaf by making quick shallow cuts 1/4 to 1/2-inch deep along the surface."", ""Using the peel, slide the loaf onto the hearth."", ""Quickly repeat the process with the second loaf."", ""Quickly spray the inner walls and floor of the oven with cold water form a spritzer bottle."", ""If there's an electric light bulb in the oven, avoid spraying it directly; it may burst."", ""Spray for several seconds until steam has filled the oven."", ""Quickly close the door to trap the steam and bake 3 minutes."", ""Spray again in the same way, closing the door immediately so that steam doesn't escape."", ""Bake until loaves begin to color, about 15 minutes."", ""Reduce heat to 425 degrees and bake until loaves are a rich caramel color and the crust is firm, 15 to 20 minutes."", ""To test for doneness, remove and hold the loaves upside down."", ""Strike the bottoms firmly with your finger."", ""If the sound is hollow, the breads are done."", ""If it doesn't sound hollow, bake 5 minutes longer."", ""Cool completely on a wire rack."", ""Note: If the dough temperature is higher than 78 degrees, put it in a cooler than (78 degree) place like the refrigerator, until the dough cools to 78 degrees."", ""If it is lower than 78 degrees, put in it a warmer than 78 degree place until the dough warms to 78 degrees."", ""The point is to try to keep the dough at 78 degrees during its fermentation."", ""If you do have to move the dough, be gentle and don't jostle it, or the dough may deflate."", ""*Couche?French for \""couch\"" or \""resting place\""."", ""This is a simple holding device you make yourself for proofing long loaves like logs, torpedo shapes, and baguettes."", ""Using well-floured canvas or linen towels create folds to separate loaves while hold them securely next to each other during proofing."", ""Use a length of fabric at least a yard long."", ""Place 12 to 16-inch wooden blocks cut from 2 by 4's at either long end to contain the loaves."", ""Or substitute large books to contain the loaves."", ""Add the flour directly into the container with the full batch of room-temperature, batterlike ripe chef."", ""Stir vigorously to add fresh oxygen to the mixture."", ""This will form a stiff consistency more like a stiff dough than a batter."", ""This firm texture is important for ripening levain, because a dense rather than loose levain creates delicious sour bread without an overpowering tangy bite."", ""Scrape down the sides, cover tightly, and let stand in a cool to moderate (about 70 degrees) draft-free place for 8 to 10 hours."", ""The levain should have doubled in volume."", ""The texture will be somewhat light, with many tiny bubbles throughout."", ""Do not let the levain stand for longer than 10 hours, or the yeast will become exhausted and not raise the final dough."", ""This recipe yields 18 ounces of levain."", ""Combine the flour and water in a tall 2 to 3-quart clear plastic container with a lid."", ""Stir well to make a thick, soft dough."", ""The exact consistency of the dough will vary with the brand of flour or water at this point to adjust the texture."", ""Scrape down the sides with a rubber spatula, cover tightly with lid and let stand in a moderate (about 70 degree) place for 24 hours."", ""Day 2 3/4 cup plus 2 tablespoons (4 ounces) 20 percent bran wheat flour 1/2 cup (4 fluid ounces) spring water"", ""The chef should have almost doubled in volume."", ""You will see tiny bubbles on the surface, and you might notice a slight musty smell."", ""Add the flour and water to the mixture and stir vigorously to distribute the fresh ingredients and add fresh oxygen to the chef."", ""The texture will still be like a soft dough."", ""You may add a little more flour or water to make this texture, if necessary."", ""Scrape down the sides, cover and place in a moderate (70 degree) draft-free place for 24 hours."", ""Day 3 3/4 cup plus 2 tablespoons (4 ounces) 20 percent bran wheat flour 1/2 cup (4 fluid ounces) spring water"", ""It will have almost doubled in volume and be quite bubbly."", ""Add the flour and water, and stir well to make a thick batter."", ""(You may have to add a little more water if your flour's absorption level is high)."", ""With a marker pen, mark the level of the chef on the side of the container."", ""Scrape down the sides, cover tightly, and let stand in a moderate (70 degree) draft-free place for 24 hours."", ""It should now be loose in texture, like a pancake batter."", ""It will have doubled in volume from the last addition of flour and water."", ""The chef may rise and fall, but as long as it doubles at some point during this last period, it's fine."", ""You now have a fully ripe chef ready to transform into a levain."", ""If you don't want to make the levain immediately, the chef can be refrigerated for up to 3 days.""]",39
