,idx,title,ingredients,directions,#actions
2191341,2191341,California Rolls,"[""1 12 cups sushi rice"", ""12 cup seasoned rice vinegar"", ""14 ounces crabmeat"", ""8 tablespoons Miracle Whip"", ""2 teaspoons salt"", ""1 cucumber"", ""1 avocado"", ""nori sushi sheet"", ""1 (8 ounce) jar sesame seeds"", ""soy sauce"", ""wasabi"", ""ginger""]","[""1."", ""We will begin by getting the rice ready."", ""First, make sure that you have a bag of \""sushi\"" rice."", ""I find that Nishiki brand sushi rice is readily available at most supermarkets."", ""Measure out 1.5 cups of this sushi rice."", ""2."", ""Pour the rice into a metal strainer."", ""Turn on your kitchen sink faucet and begin to rinse the rice underneath the water."", ""I like to have a spoon on hand so that I can turn the rice while I'm rinsing it."", ""3."", ""Rinse under the faucet until the water is nearly clear (and no longer white)."", ""4."", ""Sit the strainer of rice aside to dry for about one hour."", ""You will notice a major improvement in the appearance of your cooked rice."", ""5."", ""While the rice is drying, I move onto preparation of what will go inside the roll."", ""First, I get my frozen crab meat sticks (Kanimi makes a nice 14 oz."", ""package)."", ""I place them in a room temperature plastic container full of water to let them thaw."", ""You may need to change the water 2 or 3 times to make sure it doesn't get ice cold."", ""6."", ""While the rice is drying, and the crab is thawing, I prepare my vegetables."", ""A typical California roll contains avocado and cucumber."", ""Begin by peeling each vegetable."", ""I use a standard peeler for the cucumber, and a pairing knife for the avocado."", ""7."", ""Once peeled (and seed removed), do your best to cut the avocado into lengthwise wedges."", ""They don't have to be perfect."", ""Just try and make them long and skinny as opposed to short and fat."", ""Keep these \""avocado wedges\"" in a plastic container."", ""8."", ""For the cucumber, keep the peeler handy."", ""I go over the cucumber with the peeler just as if I were taking off the peel."", ""In this case, though, keep the strips in a plastic container."", ""These are your \""cucumber strips\""."", ""9."", ""Get some cellophane and wrap your rolling mat with the cellophane."", ""I usually go around it several times, and both ways (across, and up-and-down)."", ""This will make your mat non-stick."", ""10."", ""Measure out your 1/2 cup of rice vinegar."", ""This is what will make your sushi rice \""sticky\"" and allow it to retain its shape."", ""Lay out a fork and a spoon next to your portion of rice vinegar."", ""Also, set out a large baking sheet and make sure you have something stiff that you can fan with (a magazine, folder, etc."", ""will work fine)."", ""11."", ""Remove three nori papers from the package."", ""Cut them lengthwise so that you remove approximately an inch of paper from each."", ""These papers tend to have a bit more nori than necessary."", ""12."", ""Once the crab is thawed, I use kitchen shears to open the bag, and cut the strips in half."", ""I dump the pieces into a food processor, and use the \""pulse\"" function until the strips are turned into smaller minced pieces (quarter inch or less in length)."", ""Don't go too crazy, or you may end up with crab meat \""powder\""!"", ""13."", ""Remove the minced crab meat from the food processor, and transfer it to a mixing bowl."", ""Add about 8 tablespoons of Miracle Whip (or mayonnaise) and 2 teaspoons of salt."", ""Mix this into the crab meat with a wooden spoon until the consistency is even."", ""This is your \""surimi\""."", ""14."", ""When your rice has sat about an hour, measure out 2 cups of water, and pour into a rice cooker."", ""If you don't have a rice cooker, a covered pot is fine."", ""Add the rice into the water and press \""cook\""."", ""For a regular pot, cook over a low flame for about 10 minutes."", ""15."", ""When rice has cooked 10 minutes (or rice cooker is done), turn off heat and allow rice to sit for about 10 more minutes."", ""16."", ""Spoon rice onto a baking sheet."", ""Add a few spoonfuls of your rice vinegar over the top of the rice."", ""Use a fork to fluff and stir the rice."", ""The idea is to coat every grain with vinegar."", ""While you are fluffing, lightly fan the rice with whatever you have available."", ""Repeat this process until you are out of the rice vinegar, then fan a bit more for good measure."", ""Your rice is now \""sticky\"" rice -- or as the Japanese call it -- \""sushi\""."", ""Sushi is not raw fish, but rather, the rice!"", ""17."", ""Turn your faucet on so that it is running cold water."", ""Fill a cup with ice cold water, and place a VERY sharp (not serrated) knife inside."", ""I also like to keep a steel wool pad or Scotch pad handy."", ""If you prefer to wear food preparing gloves, feel free."", ""18."", ""Lay out one of your \""cut\"" sheets of nori seaweed paper."", ""19."", ""Moisten your hands with cold water."", ""Coat all but the back edge with about 1/4 inch of rice."", ""You will probably need to rinse rice off of your fingers/hands a few times."", ""That is why I keep cold water running, and I work near a sink."", ""This also prevents the rice from sticking to your fingers."", ""Usually, a ball of rice about the size of a baseball will cover most of the nori."", ""Leave that back edge devoid of rice."", ""That will eventually become your \""seam\""."", ""20."", ""When you have your nori coated with 1/4 inch of rice, sprinkle with sesame seeds."", ""You can also add masago (orange fish eggs) if you prefer."", ""20."", ""Flip over your paper so that the rice is facing down, and the seaweed is facing up."", ""The edge without rice should be right next to you."", ""21."", ""Lay out avocado wedges end-to-end along the midline of your paper going from the left to the right edge."", ""Add fingerfulls of surimi crab meat alongside the avocado wedges."", ""Then, lay out strips of cucumber along the other side of the surimi crab meat."", ""You will notice that the crab meat is \""confined\"" between the avocado line and the cucumber line."", ""22."", ""Lift up the edge of the mat near you, and begin to roll the \""riceless\"" end of the paper forward over the ingredients you laid out along the middle."", ""23."", ""When that edge makes contact with the seaweed paper (i.e."", ""you have formed a circle), pull back on your mat a bit to tighten the roll."", ""This will \""seal\"" your seam (the point when the seaweed joins)."", ""24."", ""Once you have pulled to seal the seam, finish rolling until you run out of paper."", ""This will \""cover\"" your seam with a bit of extra rice so the seam doesn't come open as easily."", ""25."", ""Lay the roll out on a cutting board."", ""Drape the mat over the top of it, then crimp the edges underneath the roll and press down lightly."", ""This is just one last way to preserve the roll's shape."", ""26."", ""With the mat still draped over the top of the roll, align the edges of the mat with each edge of the roll."", ""Lightly pat the edge of the roll with your palm to \""flatten\"" them (i.e."", ""no ingredients sticking way out)."", ""27."", ""Get your ice cold sharp knife."", ""Gently cut the roll down the center."", ""By gently, I mean do not even force it down with your arm strength."", ""Only use your arm strength to \""saw\""."", ""Let the weight of the blade accomplish the downward cutting."", ""If you press down while you cut, your roll will be flat where you cut it."", ""You want it to be round."", ""28."", ""After you cut it down the middle, lay out the two halves next to each other."", ""Rinse your blade off, and I recommend brushing off the rice residue with a steel wool pad."", ""That residue will only make it harder to cut on subsequent attempts, so I find that it is best to get rid of it completely."", ""29."", ""With the two halves next to each other, make 2-3 cuts across both halves -- again cutting very gently, and rinsing the blade between cuts."", ""Obviously, more cuts produce thinner pieces."", ""If you're a beginner, you'll probably only feel comfortable making 2 cuts -- and you'll end up with super-filling thick roll pieces."", ""30."", ""In a lot of sushi restaurants, they throw away the end pieces because they look bad compared to the middle pieces -- and I tend to agree."", ""But you don't have to waste the food if you don't want to!"", ""Clearly, you can see now that there is a certain \""art\"" to sushi-making."", ""It takes some time to get very good at it."", ""31."", ""Lay out your pieces on a plate."", ""Serve with soy sauce and -- if available -- wasabe (adds a lot of spice to the soy sauce) and pickled ginger (can be eaten to cleanse the palate)."", ""Eat with chopsticks.""]",32
2206555,2206555,Panettone,"[""3 tablespoons (1.5 oz / 42.5 g) mother starter (page 42), cold or at room temperature"", ""1 1/3 cups (6 oz / 170 g) unbleached bread flour"", ""1/4 cup plus 2 tablespoons (3 oz / 85 g) water, at room temperature"", ""All of the sourdough starter (9 oz / 255 g)"", ""1 tablespoon (0.75 oz / 21 g) honey"", ""1/4 cup (2 oz / 56.5 g) lukewarm water (about 95F or 35C)"", ""1 teaspoon (0.11 oz / 3 g) instant yeast"", ""1 egg (1.75 oz / 50 g), at room temperature"", ""3 egg yolks (2.25 oz / 65 g), at room temperature"", ""1 tablespoon (0.5 oz / 14 g) vanilla extract"", ""1 2/3 cups (7.5 oz / 213 g) unbleached bread flour or high-gluten flour"", ""3/4 teaspoon (0.21 oz / 4 g) salt, or 1 1/4 teaspoon coarse kosher salt"", ""3 tablespoons (1.5 oz / 43 g) sugar"", ""3/4 cup (6 oz / 170 g) unsalted butter, at room temperature"", ""1 1/3 cups (8 oz / 227 g) dried or candied fruit (optional; see variations for full details)""]","[""To make the starter, combine all of the ingredients in a mixing bowl."", ""If using a mixer, use the paddle attachment and mix on the lowest speed for 1 minute, then increase to medium speed for about 30 seconds."", ""If mixing by hand, stir for about 2 minutes, until well blended."", ""The starter should feel doughlike and tacky or slightly sticky; if not, stir in additional flour or water as needed."", ""Transfer the starter to a lightly floured work surface and knead for about 30 seconds."", ""Place the starter in a clean, lightly oiled bowl, cover the bowl loosely, and leave at room temperature for 6 to 8 hours, until the starter doubles in size or swells considerably."", ""You can use it immediately or put it in the refrigerator for up to 4 days."", ""To make the dough, cut the starter into 10 to 12 pieces and put the pieces in a mixing bowl."", ""Separately, stir the honey into the lukewarm water until dissolved, then whisk in the instant yeast until dissolved."", ""Let the mixture sit for 1 minute, then pour it over the the starter and stir to soften the starter."", ""Separately, whisk the egg, egg yolks, and vanilla together, then add to the starter mixture and stir until evenly incorporated."", ""Add the flour and salt."", ""If using a mixer, use the paddle attachment and mix on the lowest speed for 2 minutes."", ""If mixing by hand, stir with a large, sturdy spoon for about 2 minutes."", ""The dough will be coarse, wet, and batterlike; although it will be soft and sticky, it should hold together."", ""Use a wet bowl scraper or spatula to scrape the dough back down into the bowl, if necessary."", ""Resume mixing on the lowest speed or by hand, gradually adding the sugar in 1/2-tablespoon increments; wait until each addition of sugar has been thoroughly incorporated before adding the next."", ""The dough should now be smoother, though still very soft and sticky."", ""Increase the mixer speed to medium-low or stir by hand more vigorously and mix for 5 minutes to develop the gluten, stopping a few times to scrape down the sides of the bowl and the paddle or spoon."", ""Switch to the dough hook and mix on medium-low speed or continue mixing by hand, gradually adding the butter in 1-tablespoon (0.5 oz / 14 g) increments; again, waiting until each addition is thoroughly incorporated before adding the next piece."", ""Scrape down the sides of the bowl and the hook or spoon as needed."", ""If using a mixer, you can increase the speed to medium-high to incorporate the butter more quickly."", ""It should take about 5 minutes to work in all of the butter, and at the end the dough should be shiny, soft, sticky if squeezed, and very supple, with a nice pillowlike feel to it when formed into a ball."", ""Scrape the bowl down and mix on medium speed or by hand for 5 minutes more to fully develop the gluten; you should be able to pull out long, taffylike strands of dough."", ""Add the dried fruit, then mix on the lowest speed with the dough hook, or by hand, for 1 or 2 minutes to evenly distribute the fruit."", ""If the fruit was soaked overnight, drain off any excess liquid and fold the fruit in by hand."", ""In this case, you may need to add about 3 1/2 tablespoons (1 oz / 28.5 g) of bread flour to compensate for the moisture in the fruit."", ""Use a wet bowl scraper or spatula to transfer the dough to a lightly floured work surface, then dust the top of the dough with flour."", ""Firm up the dough and form it into a smooth ball by stretching and folding it once, as shown on page 18."", ""Weigh out the desired size of pieces, form them into balls, and place in oiled molds or pans."", ""Depending on the type of bread youre making, the dough will either double or triple in size as it rises."", ""If using a full-size pandoro pan or panettone mold, youll need about 24 ounces (680 g) of dough, which will fill the mold one-third full."", ""If using smaller molds, including popover molds, use however much dough is required to fill each mold one-third full."", ""Let the panettone rise for 12 hours."", ""You can also refrigerate the dough and bake it anytime during the next 4 days, but the rising time will be quite long, closer to 14 hours."", ""About 15 minutes before baking, preheat the oven to 350F (177C)."", ""For loaves weighing more than 1 1/2 pounds, preheat the oven to 325F (163C)."", ""The baking time will vary depending on the size of the panettone, ranging from 30 minutes for smaller shapes to 45 minutes or longer for large loaves."", ""The panettone is done when it is a golden brown on all sides, when the loaf sounds hollow when thumped on the bottom, and when the internal temperature is about 185F (85C) in the center."", ""It should still feel slightly soft and tender if squeezed but will firm up as it cools."", ""Cool in the pan for at least 5 minutes before removing; if baked in paper panettone molds, it isnt necessary to remove the paper."", ""Large panettone should be cooled upside down on a wire rack, and any form of panettone should be cooled thoroughly before serving."", ""Many bakers insist that panettone needs at least 8 to 14 hours of cooling, but 3 hours should be sufficient."", ""If using dried fruit, such as raisins, dried cranberries, or dried cherries, you can simply add them to the dough as directed, or soak them overnight in rum, brandy, or liqueur, using 1 tablespoon (0.5 oz / 14 g) of liqueur for every 3 tablespoons (1 oz / 28.5 g) of fruit."", ""You can also make your own soaking syrup by bringing 1/2 cup (4 oz / 113 g) of sugar and 1/2 cup (4 oz / 113 g) of water to a boil to make a simple syrup."", ""When it cools, add 1 teaspoon (0.16 oz / 4.5 g) of orange or lemon extract, and 1 teaspoon (0.16 oz / 4.5 g) of vanilla and 1 teaspoon (0.16 oz / 4.5 g) of almond extract (optional)."", ""Add the fruit to the syrup and let it soak overnight."", ""Another excellent option for flavoring the fruit is Fiori di Sicilia."", ""This wonderfully aromatic and delicious essence that combines vanilla and citrus is available from King Arthur Flour and other suppliers of specialty ingredients."", ""If you soak the fruit using either of these methods, strain off the the excess liquid, then fold the fruit into the dough by hand, along with about 3 1/2 tablespoons (1 oz / 28.5 g) of extra bread flour."", ""You can decorate the top of the baked panettone with white fondant glaze (see page 144), or any other glaze that you like."", ""This recipe makes exquisite brioche as well as holiday bread."", ""For brioche, simply omit the fruit."", ""(See below for instructions on shaping brioche a tete.)"", ""For an extra treat, top the brioche with streusel (see page 154) before baking."", ""Another option is to use the dough as a tartlet shell and fill it with clafouti, a fruit-filled custard."", ""To shape brioche a tete, roll one end of a small ball of dough (typically 1 1/2 to 2 ounces or 42.5 to 56.5 grams) into a cylindrical cone."", ""Poke a hole in the thick end, then slip the tip of the cone through it so that a nub of dough pokes through to make a head."", ""Transfer the shaped dough to greased brioche molds.""]",32
2230400,2230400,Perfect Pie Crust 101,"[""1 1/2 cups all-purpose flour"", ""1 tablespoon sugar"", ""1/4 teaspoon salt"", ""1/3 cup plus 1 tablespoon vegetable shortening, chilled, cut into 1/2-inch cubes"", ""3 tablespoons unsalted butter, chilled, cut into 1/2-inch cubes"", ""1/4 cup ice-cold water"", ""1 large egg yolk"", ""1/2 teaspoon cider or wine vinegar"", ""2 1/4 cups all-purpose flour"", ""1 1/2 tablespoons sugar"", ""1/2 teaspoon salt"", ""1/2 cup plus 1 tablespoon vegetable shortening, chilled, cut into 1/2-inchcubes"", ""5 tablespoons ( 1/2 stick plus 1 tablespoon) unsalted butter, chilled, cut into 1/2-inch cubes"", ""1/3 cup plus 1 tablespoon ice-cold water"", ""1 large egg yolk"", ""3/4 teaspoon cider or wine vinegar""]","[""In a large bowl, mix the flour, sugar, and salt until combined."", ""Using a pastry blender, rapidly cut the shortening and butter into the flour mixture until it is the consistency of coarse bread crumbs with some pea-sized pieces."", ""Do not blend to a fine cornmeal-like consistency."", ""If the fats stick to the wires of the blender, scrape them off."", ""In a glass measuring cup, mix the ice water, egg yolk, and vinegar."", ""Tossing the flour mixture with a fork, gradually add the ice-water mixture, sprinkling it all over the ingredients in the bowl."", ""Be stingy with the wateryou can always add more, but it is difficult to remedy pie dough that is too wet."", ""Mix well, being sure to moisten the crumbs on the bottom of the bowl."", ""Add just enough liquid that the dough clumps together."", ""It does not have to come together into one big ball."", ""To check the consistency, press the dough between your thumb and forefinger."", ""The dough should be moist, but not wet and not crumbly."", ""If necessary, gradually mix in more ice water, 1 teaspoon at a time, until you reach the correct consistency."", ""Gather up the dough into a thick disk and wrap in wax paper or plastic wrap."", ""If making a double-crust pie, divide the dough into two disks, one slightly larger than the other."", ""Refrigerate the dough for at least 30 minutes and up to 2 days."", ""The optimum rest period is 2 hours, which allows the dough to relax and chill without becoming rock hard."", ""If the dough is well chilled and hard, let it stand at room temperature for 10 to 15 minutes to soften slightly before rolling out."", ""To roll out a single crust, sprinkle the work surface (preferably a pastry or cutting board) lightly but completely with flour, then spread out the flour with the palm of your hand into a very thin layer."", ""Place the dough on the work surface, then sprinkle the top of the dough with a little flour."", ""Dont bother to sprinkle the rolling pin with flourit just falls off."", ""Starting at the center of the disk, roll the dough away from you."", ""Do not roll back and forth."", ""Think of stretching, not rolling, the dough into shape."", ""(If the dough cracks while you are rolling out, it may be too cold."", ""Let it stand for a few minutes to warm up slightly, then try again.)"", ""Turn the dough a quarter of a turn."", ""Roll out again from the center of the dough."", ""Continue rolling out the dough, always starting from the center of the dough and turning it a quarter turn after each roll, until the dough is about 13 inches in diameter and 1/8 inch thick."", ""(If you arent sure what 1/8 inch looks like, stand a ruler up next to the dough and check."", ""This sounds elementary, but many bakers make the mistake of rolling out the dough too thin or too thick, and until you learn by practice, a ruler is the best insurance.)"", ""Be sure that the dough is the same thickness throughout, especially at the edges, which tend to be thicker than the center."", ""Work as quickly as possible so the dough doesnt get too warm."", ""Carefully fold the dough in half."", ""If you think the dough is too warm to fold without breaking, and you have rolled out the dough on a cutting board, transfer the entire board to a cool placeif its a cold day, outside, on a windowsill, or in an unheated room is finefor a few minutes to firm up."", ""Transfer the dough to the pie pan, with the fold in the center of the pan."", ""Unfold the dough, letting the excess dough hang over the sides of the pan."", ""Gently press the dough snugly into the corners of the pan."", ""If the dough cracks, just press the cracks together."", ""Gaps can be patched with a scrap of dough, moistened lightly around the edges to adhere it to the crust."", ""Using kitchen scissors or a sharp knife, trim the dough to extend only 1/2 inch beyond the edge of the pan."", ""To flute the crust, fold over the dough so the edge is flush with the edge of the pan."", ""Use one hand to pinch the dough around the knuckle or fingertip of your other hand, moving around the crust at 1-inch intervals."", ""Cover the dough with plastic wrap and freeze until ready to use, 20 to 30 minutes."", ""To roll out a double-crust pie, roll out the larger dough disk, place it in the pan, and trim the edges so they hang about 1/2 inch over the pan."", ""Fill the pie with the cooled filling, if necessary."", ""Immediately roll out the smaller disk of dough into a 10- to 11-inch round about 1/8 inch thick."", ""Fold the dough in half, position over the filling, and unfold."", ""Press the edges of the two crusts together to seal."", ""Using kitchen scissors or a sharp knife, trim the dough to extend only 1/2 inch beyond the edge of the pan."", ""Flute the dough as directed in step""]",32
