,idx,title,ingredients,directions,#actions
1865098,1865098,Torta della Nonna,"[""1 1/2 cups unbleached pastry flour or unbleached all purpose flour, plus more for dusting"", ""3/4 cup confectioners sugar, plus more for dusting"", ""1/2 cup (1 stick) cold, unsalted butter, cut into cubes"", ""1/4 teaspoon Italian leavening, such as Bench Mate, Pane Angel, or Rebecchi, or 18 teaspoon baking soda and 18 teaspoon baking powder"", ""Pinch of kosher salt"", ""4 extra large egg yolks"", ""1/4 teaspoon vanilla extract (if not using Italian leavening)"", ""All purpose flour, for dusting"", ""Unsalted butter, for the pan"", ""1 extra large egg white"", ""13 cup toasted pine nuts (see Notes)"", ""10 ounces Philadelphia style cream cheese"", ""1 cup mild-flavored fresh goat cheese, such as Coach Farms goat cheese"", ""5 tablespoons unsalted butter, at room temperature"", ""1/4 cup mascarpone cheese"", ""1/4 cup plus 1 tablespoon unbleached pastry flour or unbleached all purpose flour"", ""1 teaspoon kosher salt"", ""3 extra large eggs"", ""1 cup sugar"", ""1 1/4 teaspoons pure vanilla extract"", ""Honeycomb"", ""Two types of single-flower honeys, such as chestnut honey and wildflower honey""]","[""To make the crust, combine the flour, confectioners sugar, butter, leavening, and salt in the bowl of a standing mixer fitted with a paddle attachment, and mix on low speed until the butter and dry ingredients form a coarse cornmeal consistency, about 2 minutes."", ""Add the egg yolks and vanilla, if you are using it, and mix on medium speed until the dough is smooth, 2 to 3 minutes."", ""Dust a flat work surface with flour and turn the dough out onto it."", ""Knead the dough for a few minutes until it comes together into a ball."", ""Wrap the dough in plastic wrap and refrigerate it for at least 1 hour and up to three days; or freeze it for up to two months."", ""(Defrost the dough overnight in the refrigerator.)"", ""Remove the dough from the refrigerator."", ""Dust a flat work surface with flour, cut the dough into chunks, and knead the dough on the countertop to soften it, until it is the texture of Play-Doh."", ""Cut off a 13 cup portion (about 2 ounces) of dough, wrap it in plastic wrap and return it to the refrigerator."", ""Line a baking sheet with parchment paper, butter the inside of an 11-inch flan ring, and place the ring on the baking sheet."", ""Remove the remaining dough from the refrigerator."", ""Dust your work surface and rolling pin with flour and roll the dough out to 2 inches larger than the ring, and to a thickness of 18 to 1/4 inch."", ""Gently fold the dough in quarters and place it on top of the flan ring, placing the point in the center and gently unfolding the dough so the ends are flopped over the ring."", ""Gently push the dough down to fit inside the ring, pressing into the crease around the inside circumference so the dough fits snugly against the corners and sides."", ""(Dont stretch the dough to fit or it will shrink during baking.)"", ""Dip the knuckle of your index finger in flour and use it to press the dough into the crease to create a straight edge, not sloping sides."", ""Roll the rolling pin over the top of the flan ring to cut the dough."", ""Pull off the trimmed dough and discard."", ""Place the tart shell in the refrigerator to chill for at least 30 minutes and up to one day."", ""Remove the 13 cup of dough from the refrigerator and place it between two sheets of parchment paper."", ""Roll it into an 8-inch circle about 116 inch thick."", ""Place the dough sandwiched between the parchment paper on a baking sheet and put it in the freezer to chill until it is firm but not frozen, about 30 minutes."", ""Adjust the oven rack so it is in the lowest position and preheat the oven to 350 degrees F and line another separate baking sheet with parchment paper."", ""Remove the sheet of dough that you rolled very thinly from the freezer, lay it on a flat work surface, remove the top sheet of parchment paper, and use the 8-inch ring to cut a circle out of the dough, working quickly so that it stays cold."", ""Pull away and discard the scraps of dough around the circle and cut the circle into eight or ten equal wedges as you would a pie however many servings you want the tart to make."", ""Still working quickly, use a metal spatula to carefully lift the wedges one at a time and place them on the prepared baking sheet, leaving about 2 inches between each."", ""Brush the wedges with the egg white."", ""Scatter 2 tablespoons of the pine nuts over the wedges, dividing them evenly, and gently press the nuts into the wedges to make sure they adhere; reserve the remaining pine nuts for serving with the tart."", ""Bake the wedges until theyre golden brown, about 8 minutes, rotating the pan in the middle of the baking time so the cookies brown evenly."", ""Remove the baking sheet from the oven and place it on a wire cooling rack until the wedges cool, and dust them lightly with powdered sugar."", ""To make the filling:"", ""Combine the cream cheese, goat cheese, butter, and mascarpone in the bowl of a standing mixer fitted with a paddle attachment and mix on low speed until the ingredients are combined and the mixture is smooth and creamy, scraping down the sides of the bowl with a rubber spatula occasionally, about 2 minutes."", ""Add the flour and salt, mix on low speed to incorporate, and transfer to a large mixing bowl."", ""Combine the eggs and sugar in the bowl you mixed the cheeses in."", ""(Theres no need to wash the bowl.)"", ""Exchange the paddle attachment for the whisk attachment on your mixer and beat the eggs and sugar together until the eggs are thick and fluffy and the sugar is dissolved, about 5 minutes."", ""Add the vanilla and beat just to incorporate."", ""Gently fold one-third of the egg mixture into the cheese, using the flat side of a spatula to smash the cheese and break up the density of the cheese with the egg."", ""Add another third of the egg mixture, folding it in with a light hand so the eggs stay light and fluffy."", ""Fold in the remaining egg mixture, mixing until the ingredients are combined but there are still visible lumps of cheese in the mix."", ""(The filling can be made up to four days in advance."", ""Transfer it to an airtight container and refrigerate until you are ready to bake the tart.)"", ""Remove the tart shell from the refrigerator and pour the filling into the shell to fill it 18 inch from the top."", ""(You may not use all of it but you dont want to overfill the ring; discard the excess.)"", ""Place the baking sheet with the tart on it in the oven to bake for about 40 minutes, rotating the baking sheet halfway through the baking time for even browning, until the filling is set and the top is golden brown."", ""Remove the baking sheet from the oven and set it aside to cool slightly."", ""Cut the tart into the same number of wedges that you cut cookie wedges."", ""You can serve the tart warm, or set it aside to cool to room temperature."", ""(To rewarm the tart, place the whole tart or individual slices on a baking sheet and put it in a 350 degrees F oven until it is warmed through; about 5 minutes for slices, about 15 minutes for a whole tart.)"", ""Just before serving, place the cookie wedges on the tart with the outside edges of the cookies about 1 inch from the edge of the tart."", ""Lift the flan ring off the tart."", ""Use a large knife to cut between the cookies, creating even slices using the cookies as a guide."", ""Use a metal spatula to carefully transfer each wedge to a dessert plate."", ""Spoon 1 teaspoon of honeycomb on one side of each wedge."", ""Spoon 1 teaspoon of each of the two honeys into circles about the size of silver dollars on either side of each wedge."", ""Scatter a few of the reserved pine nuts in the center of each pool of honey, but not the honeycomb, and serve.""]",36
2108353,2108353,Pain a lAncienne Rustic Bread,"[""4 1/2 cups (20 oz / 567 g) unbleached bread flour"", ""1 3/4 teaspoons (0.4 oz / 11 g) salt, or 2 1/2 teaspoons coarse kosher salt"", ""1 1/4 teaspoons (0.14 oz / 4 g) instant yeast"", ""2 cups (16 oz / 454 g) chilled water (about 55F or 13C)"", ""1 tablespoon (0.5 oz / 14 g) olive oil (for ciabatta only)""]","[""Combine the flour, salt, yeast, and water in a mixing bowl."", ""If using a mixer, use the paddle attachment and mix on the lowest speed for 1 minute."", ""If mixing by hand, use a large spoon and stir for about 1 minute, until well blended."", ""The dough should be coarse and sticky."", ""Let the dough rest for 5 minutes to fully hydrate the flour."", ""If making ciabatta, drizzle the olive oil over the dough; if making mini baguettes, omit the oil."", ""Then mix on medium-low speed using the paddle attachment, or by hand using a large, wet spoon or wet hands, for 1 minute."", ""The dough should become smoother but will still be very soft, sticky, and wet."", ""Use a wet bowl scraper or spatula to transfer the dough to a clean, lightly oiled bowl."", ""Cover the bowl with plastic wrap and let the dough rest at room temperature for 10 minutes."", ""Transfer the dough to a lightly oiled work surface."", ""With wet or oiled hands, reach under the front end of the dough, stretch it out, then fold it back onto the top of the dough."", ""Do this from the back end and then from each side, then flip the dough over and tuck it into a ball."", ""The dough should be significantly firmer, though still very soft and fragile."", ""Place the dough back in the bowl, cover, and let sit at room temperature for 10 minutes."", ""Repeat this process three more times, completing all repetitions within 40 minutes."", ""(You can also perform the stretch and folds in the bowl, as shown on page 17.)"", ""After the final stretch and fold, immediately cover the bowl tightly and refrigerate overnight or for up to 4 days."", ""The dough will rise, possibly to double its original size, in the refrigerator."", ""(If you plan to bake the dough in batches over different days, you can portion the dough and place it into two or more oiled bowls at this stage.)"", ""Remove the dough from the refrigerator about 1 hour before baking for mini baguettes, and 3 hours in advance for ciabatta (or an hour earlier if the dough hasnt increased to 1 1/2 times its original size in the refrigerator overnight)."", ""To make ciabatta, about 1 hour after taking the dough out of the refrigerator, line the back of a sheet pan with parchment paper and generously dust the entire surface with flour."", ""Use a wet or oiled bowl scraper to transfer the dough to the work surface, taking care to handle the dough as little as possible to avoid degassing it."", ""Dust the top surface of the dough with flour and also flour your hands."", ""Using your hands or a metal pastry scraper, gently coax and pat the dough into a rough square measuring about 9 inches on each side, still taking care to degas it as little as possible."", ""For small ciabatta, cut the dough into 3 even strips about 3 inches wide and 9 inches long (the pieces will each weigh about 12 ounces or 340 grams)."", ""For larger ciabatta, cut the dough in half."", ""With floured hands, gently fold the dough in thirds, like folding a letter but without applying any pressure."", ""Gently roll the folded dough in the dusting flour to coat it, then lift the dough and place it on the parchment paper, again rolling it in the dusting flour on the parchment."", ""Rest the dough seam side down on the parchment and repeat with the other pieces of dough."", ""Mist the tops of the dough pieces with spray oil and loosely cover the pan with plastic wrap or a clean, lint-free towel."", ""After 1 hour, gently roll the pieces over so the seam side is up, lift and cradle each piece with floured hands, and, working from the underside, gently coax it to a length of 5 inches (for small ciabatta) to 7 inches (for large ciabatta)."", ""Lay the pieces back on the parchment seam side up."", ""Straighten the sides of each piece with your hands or a pastry scraper so that they are more rectangular than oblong, mist with spray oil again, then cover loosely and proof for 1 hour more."", ""About 45 minutes before baking, preheat the oven to 550F (288C) or as high as it will go, and prepare the oven for hearth baking (see page 30)."", ""Slide the dough, parchment and all, onto the stone; if you arent using a baking stone, simply put the whole pan into the oven."", ""Pour 1 cup of hot water into the steam pan, then lower the oven temperature to 450F (232C)."", ""Bake for 12 minutes, then rotate the pan and bake for 15 to 20 minutes more, until the crust is a rich brown (streaked with the dusting flour)."", ""The bread should puff a little, and the crust should be hard when tapped (itll soften as it cools)."", ""Cool on a wire rack for 45 minutes before slicing."", ""To make mini baguettes, about 45 minutes before baking, preheat the oven to 550F (288C), or as high as it will go, and prepare the oven for hearth baking (see page 30)."", ""After the dough has been out for 1 hour, generously dust the entire surface of a wooden peel with flour or line the back of a sheet pan with parchment paper (you can either dust the parchment with flour or mist it with spray oil so that you can slide and move the dough if need be)."", ""Use a wet or oiled bowl scraper to transfer the dough from the bowl to the work surface, taking care to handle the dough as little as possible to avoid degassing it."", ""Dust the top surface of the dough with flour and also flour your hands."", ""Using your hands or a metal pastry scraper, gently coax and pat the dough into a rough square about 8 inches on each side, still taking care to degas it as little as possible."", ""Cut off a slice of dough about 1 1/2 inches wide and roll it into the dusting flour to lightly coat it and keep it from sticking to the remainder of the dough."", ""Working with floured hands and tools, carefully transfer the slice to the prepared peel or parchment paper, cradling it with both hands to keep it from stretching too much."", ""You can straighten it by spreading your hands underneath the dough as you lay it down; it should elongate slightly, to 9 to 10 inches."", ""Repeat with the rest of the dough, placing the pieces 1 inch apart, until the peel or parchment is full."", ""If you cant fit all of the pieces on the peel or parchment, bake those that are ready before cutting the remainder."", ""Its better to work in manageable batches than to try to cram all of them in the oven, especially if your stone or oven wont easily hold all of them."", ""Scoring the dough is an option, but because it risks degassing the dough, I advise against it until you have made these a few times."", ""Slide the mini baguettes onto the baking stone using short, quick back-and-forth motions with the peel, or by sliding the parchment paper onto the stone."", ""Pour 1/2 cup of hot water into the steam pan, then lower the oven temperature to 475F (246C)."", ""Bake for 12 to 18 minutes total, rotating the pan as needed for even browning."", ""The crust should be a rich brown, the loaves should puff a little, and the crust should be hard when tapped (the crust will soften slightly as the bread cools)."", ""Cool on a wire rack for at least 15 minutes."", ""For an interesting ciabatta texture and a nice design on the surface of the bread, mix a small amount of coarse rye flour or whole wheat flour in with the dusting flour.""]",36
2117924,2117924,Long-Cooked Sugo and Meatballs,"[""6 tablespoons extra virgin olive oil"", ""2 medium onions (3/4 pound), minced in a food processor"", ""3 or 4 plump shallots, minced in a food processor"", ""2 or 3 fat garlic cloves, minced in a food processor (about 2 tablespoons)"", ""1 large carrot, minced in a food processor (about 1 cup)"", ""2 large stalks celery, minced in a food processor (about 1 cup)"", ""5 or 6 fresh bay leaves"", ""1/4 cup tomato paste"", ""One 35-ounce can San Marzano plum tomatoes and juices, passed through a food mill (4 cups)"", ""8 to 12 cups or more hot Turkey Broth (page 80) or Simple Vegetable Broth (page 288) or plain hot water"", ""1/2 teaspoon salt, plus more if needed"", ""1 cinnamon stick or 2 tablespoons finely grated orange zest"", ""1 tablespoon fresh thyme leaves, stripped from the stem"", ""1/4 teaspoon peperoncino (hot red pepper flakes), or to taste"", ""A 12-inch heavy-bottomed saucepan or Dutch oven, 8-quart capacity. You will need this width and depth to braise the meatballs.""]","[""Pour the olive oil into the pan, drop in the onions and shallots, and set over medium high heat."", ""Stir for a minute or two, until the onions begin to sizzle."", ""Drop the garlic into a hot spot and spread it out to caramelize for a minute, then stir with the onions."", ""Stir in the carrot and celery, and get them cooking; drop in the bay leaves and cook the soffritto for another 4 minutes, until it is starting to dry out."", ""Lower the heat if necessary to prevent burning."", ""Push the vegetables to the side and drop the tomato paste into a hot spot."", ""Toast it for a minute or more, then blend it into the soffritto."", ""Pour in the milled tomatoes and juices, and stir; slosh the tomato container with a cup of hot broth or water and stir that in too."", ""Bring the sauce to a boil quickly, and cook over medium-high heat for 5 minutes or more, stirring frequently, until it has just begun to thicken."", ""Pour in 4 cups of the hot broth, stir it in, and note now the level of the liquid in the pan: this is about the level that the sugo should be at the very end of cooking, after the meatballs have been removed."", ""Stir in another quart of the broth, and bring to a lively boil."", ""For turkey meatballs, submerge the cinnamon stick in the sauce."", ""For sausage meatballs, stir in the orange zest, fresh thyme leaves, and up to 1/2 teaspoon of peperoncino, to taste."", ""Cover the pot and adjust the heat to maintain a steady but gentle bubbling all over the surface of the sugo."", ""Let it cook for at least an hour or longer, checking the pot every 20 minutes or so."", ""It should be reducing steadily."", ""If its barely dropping, or not at all, raise the heat and set the cover ajar to speed its concentration."", ""If its dropping extremely fast, lower the heat to slow the evaporation."", ""Add hot broth or water if needed to keep the sauce at the level you want."", ""Make either the turkey or sausage meatballs while the sugo cooks, following the directions at the end of this recipe."", ""Have the sugo at a gentle simmer over low heat when the meatballs are fried and ready to go into the saucepan."", ""Have hot broth or water on hand if needed."", ""Drop the meatballs in one at a time; fit as many as you can in the bottom of the pan in one layer, but leave enough space to roll them around."", ""Drop the rest of the meatballs in to make a second layer."", ""Add hot broth or water if necessary so the meatballs are all covered with liquid."", ""Stir gently to mix the broth with the sugodont break the meatballs!"", ""Cover the pan and raise the heat slightly to bring the sugo back to a simmer."", ""Set the cover ajar and adjust heat to maintain steady simmering (but no threat of burning the meat on the bottom), and cook the meatballs for 35 to 40 minutes."", ""Turn off the heat and let the meatballs cool in the sugo and absorb more of its flavor (unless you need them right away)."", ""When cool, remove them to a big bowl."", ""If the sauce is thin (probably well above the 2-quart mark), return it to a boil gradually and cook it uncovered to thicken."", ""Stir frequently as it thickens; reduce it to the 2-quart level, or to whatever consistency you likethats the most important guideline."", ""Taste the sauce during this final cooking, and add salt, if needed, or adjust the other seasonings."", ""Serve sauce and meatballs right away if you want."", ""Otherwise, pack the meatballs in containers with enough sugo to cover and the rest of the sauce in separate containers."", ""Portion them, for convenience, in the amounts youll use in different dishes."", ""Store in the refrigerator for 4 days, or for several months in the freezer."", ""Frying meatballs before adding them to the sauce adds another layer of flavor and creates a crust that holds the meat together so the ball doesnt break apart in the sauce."", ""But it is not essential, and unfried meatballs can be quite good providing they have lots of sauce to cook in, so increase the sauce by a third (or decrease the meatballs by a third) if you choose the unfried method."", ""As a topping for a big bowl of dressed pasta (ziti, rigatoni, spaghetti)"", ""As a meat course with vegetables, following a first course of dressed pasta"", ""With fresh pasta (tagliatelle, pappardelle)"", ""In baked pasta, such as cavatappi-and-meatball torta (page 196; 2 cups of sugo and 6 meatballs needed)"", ""As a topping for polenta"", ""Gnocchi"", ""In a risotto, using the sauce and broken-up meatballs"", ""In a fresh-pasta Lasagna with Sausage Meatballs and Sugo (page 206; 4 cups of sugo and 12 meatballs needed)"", ""As a filling and sauce for ravioli"", ""In a sandwich"", ""Sugo, or gravy, is a long-cooking sauce that has a big component of meat in it, which releases its flavors as it cooks and transforms the sauce into a more complex and flavorful gravy."", ""This is the base in which I cook meatballs."", ""Here I give you two different recipes for meatballs, one made from turkey meat and the other made from sausage meat."", ""Both are quite easy to make."", ""The common denominator in both is the sugo, and the base for a good sugo is a soffrittothat essential Italian technique of cooking vegetables and aromatics in fat or olive oil slowly over low heat."", ""Italian cuisine uses a soffritto as the start of many dishessoups, braised meats, and pasta sauces."", ""For this sugo the soffritto is made of onions, garlic, carrots, celery, and shallots."", ""It is the first thing that goes into the pot with the olive oil."", ""The sugo can be cooked to the halfway point (which it reaches after about 30 minutes of cooking) in advance."", ""Then, when you are ready with the meatballs, add them to the unfinished sugo and continue to cook together until done."", ""You can also make the meatballs in advance, freeze them, and when you are ready proceed with the final cooking in the sauce.""]",36
